authorMeta/fans,authorMeta/following,authorMeta/verified,authorMeta/video,commentCount,createTimeISO,diggCount,playCount,shareCount,text,videoMeta/duration,clean_text,has_we,has_them,we_count,them_count,pronoun_type,has_othering,othering_score,matched_patterns,othering_predicted,othering_proba,toxicity,severe_toxicity,identity_attack,insult,threat,emotion,emotion_score
9100000,4163,False,958,24800,2020-12-28T02:18:41.000Z,5700000,31800000,283200,Shot roulette  #like #follow #fyp #shots,46,shot roulette like follow fyp shots,False,False,0,0,none,False,0,[],0,0.0,0.0889404937624931,0.0002146068000001,0.0004835323488805,0.0024742598179727,0.0004009232216048,neutral,0.9999066591262816
161800,462,False,15,21000,2020-05-24T21:45:46.000Z,5700000,30200000,84400,Send a dirty text to your boyfriend around a bunch of people #fyp #foryou #foryoupage #like #follow #trendingsong #tiktok #sendthistosomeone,23,send a dirty text to your boyfriend around a bunch of people fyp foryou foryoupage like follow trendingsong tiktok sendthistosomeone,False,False,0,0,none,False,0,[],0,0.0,0.8920252323150635,0.0049514146521687,0.0070117986761033,0.256731241941452,0.00228643999435,annoyance,0.983375608921051
249400,24,False,217,49800,2021-02-11T07:54:44.000Z,5700000,22900000,252600,#fyp #foryoupage #foryou #chunkz #yungfilly #betasquad #youtube #viral #trending #like #comment #share #manlikefatz1,59,fyp foryoupage foryou chunkz yungfilly betasquad youtube viral trending like comment share manlikefatz1,False,False,0,0,none,False,0,[],0,0.0,0.0552683249115943,0.000162721669767,0.0002707051753532,0.0016068491386249,0.0002603234024718,neutral,0.9999884366989136
114800,84,False,402,42500,2021-05-19T12:24:42.000Z,5500000,25600000,97500,Why did this just bird square up on me.. #MakeMomEpic #fyp #IFeelWeightless #foryou #like #follow #viral #bird #sunconure #fight,10,why did this just bird square up on me.. makemomepic fyp ifeelweightless foryou like follow viral bird sunconure fight,False,False,0,0,none,False,0,[],0,0.0,0.112138532102108,0.0001848282699938,0.0006353510543704,0.0037242255639284,0.0005568070337176,neutral,0.9995317459106444
162400,68,False,19,23400,2020-05-10T22:23:49.000Z,5500000,22500000,22600,Repost #family #adoption #love #fyp #fypage #foryou #foryourpage #bedroomcheck #musicmatters #itsaremix #momsoftiktok #missouri #like #tiktok #fy #mom,19,repost family adoption love fyp fypage foryou foryourpage bedroomcheck musicmatters itsaremix momsoftiktok missouri like tiktok fy mom,False,False,0,0,none,False,0,[],0,0.0,0.7100014686584473,0.0040313825011253,0.020570458844304,0.1954025626182556,0.0017788180848583,neutral,0.910469114780426
1400000,658,False,139,132300,2021-05-01T17:33:59.000Z,25600000,212200000,171200,#outfishing_bc #TikTokGGT #fishing #sturgeon #sturgeonfishing #tiktok #fraserriver #bccanada #tiktokindia #riverfishing #fish #letsgo #tankz,9,outfishing bc tiktokggt fishing sturgeon sturgeonfishing tiktok fraserriver bccanada tiktokindia riverfishing fish letsgo tankz,False,False,0,0,none,False,0,[],0,0.0,0.0745948553085327,0.0002591150114312,0.0004492558946367,0.0020380062051117,0.0003982501220889,neutral,0.9999573230743408
3400000,79,False,73,407300,2021-09-29T00:27:17.000Z,22900000,145400000,1000000,✨Cat care routine✨#foryou #fyp #foryourpage #cat #catsoftiktok #catlover #cat #petlover #petoftiktok #bathcat #viral #tiktok #viralcat,36,cat care routine foryou fyp foryourpage cat catsoftiktok catlover cat petlover petoftiktok bathcat viral tiktok viralcat,False,False,0,0,none,False,0,[],0,0.0,0.0488801561295986,0.0001454095763619,0.0003573458525352,0.0016165507258847,0.0002875024219974,neutral,0.9999886751174928
13000000,179,True,629,181500,2021-08-08T03:07:01.000Z,21000000,231200000,259700,Which one is your favorite <3?#insecthaus #tiktok #animals,14,which one is your favorite 3? insecthaus tiktok animals,False,False,0,0,none,True,1,['animals'],1,0.25,0.001598855247721,9.145334479399024e-05,0.0001560211821924,0.0002040266117546,0.0001075715117622,curiosity,0.9995619654655457
1900000,8,False,320,115600,2022-04-13T16:06:55.000Z,20800000,235000000,347500,I tuoi animali domestici sono obbedienti?#animale #pappagallo #tiktok #grazia,21,i tuoi animali domestici sono obbedienti? animale pappagallo tiktok grazia,False,False,0,0,none,False,0,[],0,0.0,0.1142568886280059,0.0002583453606348,0.0014683944173157,0.0021829772740602,0.0007521871011704,neutral,0.9998600482940674
5100000,37,False,136,233600,2021-01-09T15:38:27.000Z,20000000,227100000,1300000,Wee #foryou #foryoupage #tiktok #wee #funny #dog #animals #4u #xyzbca #fypage #fail #fyp #viral,7,wee foryou foryoupage tiktok wee funny dog animals 4u xyzbca fypage fail fyp viral,False,False,0,0,none,True,1,['animals'],1,0.25,0.5525820851325989,0.0007420983165502,0.0028802575543522,0.0343052335083484,0.0011346579995006,neutral,0.9962419271469116
8000000,69,True,147,214600,2020-09-05T23:27:18.000Z,19400000,169500000,433300,Our WHOLE Zoom class pranked our teacher  (she was so confused!!) #foryou #foryoupage #fyp #tiktok #viral #funny #trend #trending #funny #lol,14,our whole zoom class pranked our teacher she was so confused!! foryou foryoupage fyp tiktok viral funny trend trending funny lol,True,False,2,0,we_only,False,0,[],0,0.0,0.0874780267477035,0.0001526923151686,0.0003286519204266,0.002961856778711,0.0002647053624968,amusement,0.897668719291687
13200000,28,True,303,66000,2020-02-25T12:11:06.000Z,19300000,200600000,377700,Ara Woah  #woah  #woahchallenge  #foryou  #fyp  #meme  #이아라  #틱톡  #tiktok,17,ara woah woah woahchallenge foryou fyp meme tiktok,False,False,0,0,none,False,0,[],0,0.0,0.5662798285484314,0.0017946588341146,0.0086241737008094,0.0412758588790893,0.0024240873754024,neutral,0.8766113519668579
11100000,103,True,61,215800,2021-05-14T19:09:45.000Z,17100000,132000000,298700,Bees swarming in the morning! #bees #truck #tiktok #animals #foryou #texas,59,bees swarming in the morning! bees truck tiktok animals foryou texas,False,False,0,0,none,True,1,"['swarm', 'animals']",1,0.25,0.0361851900815963,0.0001254646194865,0.0003963884955737,0.0010100184008479,0.0002938335819635,neutral,0.9999914169311525
13200000,28,True,303,45700,2020-01-08T13:21:44.000Z,17000000,178300000,629300,Ara Woah #woah #woahchallenge #foryou #tiktok #poodle #dogchallenge #dog #trick #dogtrick #이아라 #킴미소,13,ara woah woah woahchallenge foryou tiktok poodle dogchallenge dog trick dogtrick,False,False,0,0,none,False,0,[],0,0.0,0.1591159105300903,0.0002453486667945,0.0007038316107355,0.0076099950820207,0.0004645501612685,neutral,0.9999048709869384
3300000,16,False,89,105100,2020-10-26T12:55:25.000Z,16700000,177500000,500000,minecraft_noon #minecraft #minecraftpe #minecraftbuilding #satisfying #build #house #foryou #pourtoi #tiktok #fyp #tendance #tiktok,30,minecraft noon minecraft minecraftpe minecraftbuilding satisfying build house foryou pourtoi tiktok fyp tendance tiktok,False,False,0,0,none,False,0,[],0,0.0,0.0888315811753273,0.0002261377230752,0.0005702067282982,0.002672107424587,0.0005438336520455,neutral,0.9999923706054688
1100000,12,False,1,131800,2021-07-16T02:39:16.000Z,16400000,215800000,504500,Did you find a lot of surprises?#goodthing#goodthings#sueful #tiktok #fypシ,58,did you find a lot of surprises? goodthing goodthings sueful tiktok fyp,False,False,0,0,none,False,0,[],0,0.0,0.0569990910589695,0.0001567333383718,0.0005615957197733,0.0036487022880464,0.0001993050973396,neutral,0.981001079082489
11100000,103,True,61,257500,2021-03-12T18:08:30.000Z,16000000,102300000,485700,Save the bees! #bees #tiktok #foryou #fyp #nature #love #animals #amazing,59,save the bees! bees tiktok foryou fyp nature love animals amazing,False,False,0,0,none,True,1,['animals'],1,0.25,0.0504997298121452,0.0001297057606279,0.0005771613214164,0.0015163919888436,0.0003655544423963,love,0.916223406791687
7300000,99,True,425,86100,2022-04-02T17:23:13.000Z,15500000,243800000,281300,That HURT‼️ #virall #funny #prank #fyp #foryourpage #tiktok,11,that hurt virall funny prank fyp foryourpage tiktok,False,False,0,0,none,False,0,[],0,0.0,0.6764628887176514,0.0014179331483319,0.0025926211383193,0.0419412888586521,0.0012783317361027,amusement,0.979972779750824
5100000,37,False,136,170600,2020-12-28T19:51:47.000Z,14700000,127700000,621700,Wee  #foryou #foryoupage #4u #tiktok #animals #xyzbca #fypage #funny #wee #dog #fyp #viral #fy,7,wee foryou foryoupage 4u tiktok animals xyzbca fypage funny wee dog fyp viral fy,False,False,0,0,none,True,1,['animals'],1,0.25,0.4987552165985107,0.0010651194024831,0.0052824788726866,0.0464147143065929,0.0011278678430244,neutral,0.9909935593605042
4000000,7,False,266,30600,2020-03-01T09:59:12.000Z,14200000,150700000,196700,#foryou #foryoupage #tiktok #viral #wow,21,foryou foryoupage tiktok viral wow,False,False,0,0,none,False,0,[],0,0.0,0.0121176978573203,0.0001151343312812,0.0001851243869168,0.0004634125798474,0.0001649236946832,admiration,0.630160927772522
359400,63,False,54,178800,2020-05-23T03:30:48.000Z,13700000,76900000,673200,Netflix vs reality  #neverhaveiever #fyp #inyourface #viral #trend #tiktok #comedy,10,netflix vs reality neverhaveiever fyp inyourface viral trend tiktok comedy,False,False,0,0,none,False,0,[],0,0.0,0.0109244603663682,9.920692536979914e-05,0.0001949383731698,0.0004947114503011,0.0001526070263935,neutral,0.9544190168380736
1900000,127,False,133,27300,2020-08-02T20:53:00.000Z,12800000,100500000,40800,it was fun while it lasted! Check out @sassybus on insta for more #byetiktok #fyp #tiktok #busconversion #vanbuild,21,it was fun while it lasted! check out on insta for more byetiktok fyp tiktok busconversion vanbuild,False,False,0,0,none,False,0,[],0,0.0,0.0413184165954589,0.0001562062097946,0.0004366291686892,0.0012468612985685,0.0004366235516499,joy,0.9966561794281006
9800000,752,True,867,65700,2020-05-27T04:14:48.000Z,12200000,191400000,341900,he thought he broke my neck!  @holygxd74  #foryou #foryoupage #tiktok,16,he thought he broke my neck! foryou foryoupage tiktok,False,False,0,0,none,False,0,[],0,0.0,0.167822927236557,0.0004965882399119,0.0010756738483905,0.0024307728745043,0.0024352483451366,neutral,0.999805748462677
495200,29,False,63,384800,2022-02-25T20:30:53.000Z,12100000,130100000,468800,Oldest woman in the world  #viral #viralvideos #tiktok,11,oldest woman in the world viral viralvideos tiktok,False,False,0,0,none,False,0,[],0,0.0,0.0126615036278963,0.0001184990323963,0.000268850417342,0.0006037033745087,0.000149180763401,neutral,0.9999371767044068
5600000,25,False,343,150700,2021-05-10T12:43:59.000Z,12000000,117700000,394000,#tiktok #whale,12,tiktok whale,False,False,0,0,none,False,0,[],0,0.0,0.0105372760444879,0.0001257348194485,0.0003851534274872,0.0005250017857179,0.0001668289332883,neutral,0.9999808073043824
3200000,617,False,109,467000,2020-06-17T20:27:34.000Z,37200000,299500000,2800000,Repost  #catsoftiktok #viral #funny #cute #cutness #foryoupage,13,repost catsoftiktok viral funny cute cutness foryoupage,False,False,0,0,none,False,0,[],0,0.0,0.0142668187618255,0.0001017254398902,0.0002280844055349,0.0006527436780743,0.0001711398654151,admiration,0.762296199798584
14500000,50,False,465,401700,2021-03-18T15:05:42.000Z,28000000,279900000,1200000,Dinky the chipmunk can fit more into his mouth then you #fyp #wholesome #viral #dinky #chipmunk,15,dinky the chipmunk can fit more into his mouth then you fyp wholesome viral dinky chipmunk,False,False,0,0,none,False,0,[],0,0.0,0.8842553496360779,0.0051743295043706,0.012823948636651,0.6160019040107727,0.0011300240876153,neutral,0.999987006187439
4200000,383,True,323,528800,2021-01-12T19:58:56.000Z,26100000,259300000,1200000,Wee!   #Wee #fyp #jump #jumping #viral #weememes #weeme @weeememes,8,wee! wee fyp jump jumping viral weememes weeme,False,False,0,0,none,False,0,[],0,0.0,0.3339036405086517,0.0005334810120984,0.0017381649231538,0.0123534658923745,0.0010651260381564,neutral,0.9999839067459106
46500000,263,True,1280,253100,2021-04-24T14:42:48.000Z,24900000,181200000,275300,@malek sameh 님과 #이어찍기 #추천 #fyp #viral #xyzbca #korean #おすすめ,11,sameh fyp viral xyzbca korean,False,False,0,0,none,False,0,[],0,0.0,0.0231882873922586,0.0001543105463497,0.0004587362054735,0.0008759816410019,0.0001948919089045,neutral,0.9999852180480956
7600000,147,False,1900,309500,2020-08-05T23:27:48.000Z,24900000,196100000,975900,every beat  #foryou #foryoupage #fyp #viral #GotMilkChallenge #TikTokRecipe,12,every beat foryou foryoupage fyp viral gotmilkchallenge tiktokrecipe,False,False,0,0,none,False,0,[],0,0.0,0.1894462704658508,0.0004495350294746,0.0008753900765441,0.0047210929915308,0.0007822955376468,neutral,0.9999853372573853
3400000,79,False,73,407300,2021-09-29T00:27:17.000Z,22900000,145400000,1000000,✨Cat care routine✨#foryou #fyp #foryourpage #cat #catsoftiktok #catlover #cat #petlover #petoftiktok #bathcat #viral #tiktok #viralcat,36,cat care routine foryou fyp foryourpage cat catsoftiktok catlover cat petlover petoftiktok bathcat viral tiktok viralcat,False,False,0,0,none,False,0,[],0,0.0,0.0488801561295986,0.0001454095763619,0.0003573458525352,0.0016165507258847,0.0002875024219974,neutral,0.9999886751174928
3700000,1725,False,366,187500,2022-03-06T12:19:17.000Z,22900000,121600000,194400,#fyp #foru #foryou #xyzbca #xyzcba #duet #stitch #viral #blowthisup #bass #basssinger #lukethevoice #seashanty,34,fyp foru foryou xyzbca xyzcba duet stitch viral blowthisup bass basssinger lukethevoice seashanty,False,False,0,0,none,False,0,[],0,0.0,0.5662895441055298,0.0027282589580863,0.0023961483966559,0.0455455668270587,0.0011350385611876,neutral,0.9999920129776
4200000,107,False,405,242900,2022-03-01T13:50:46.000Z,22500000,177600000,953900,On today’s episode of 17 kids and counting… #fyp #viral #babygoat #bottlefeeding,59,on today s episode of 17 kids and counting fyp viral babygoat bottlefeeding,False,False,0,0,none,False,0,[],0,0.0,0.3831018507480621,0.0007893607253208,0.0019343880703672,0.0526919662952423,0.0003581650671549,neutral,0.9999918937683104
3600000,16,True,214,106000,2021-05-31T14:59:05.000Z,21700000,135300000,69600,@khaby.lame #art #drawing #cut #viral #global #eduwoes  Who is next?,44,.lame art drawing cut viral global eduwoes who is next?,False,False,0,0,none,False,0,[],0,0.0,0.0316854417324066,0.0001044167438521,0.0002840696251951,0.0010780175216495,0.0001921884831972,confusion,0.8550257682800293
46500000,263,True,1280,262100,2021-03-11T14:41:32.000Z,21000000,170500000,303700,@a.k.a qdesw. 님과 #이어찍기 #추천 #fyp #viral #xyzbca #korean #おすすめ,13,.k.a qdesw. fyp viral xyzbca korean,False,False,0,0,none,False,0,[],0,0.0,0.0120442947372794,0.0001305090700043,0.0004023321962449,0.000538631575182,0.000147403232404,neutral,0.9999890327453612
46500000,263,True,1280,244100,2021-05-02T14:41:30.000Z,20100000,189900000,375600,@nameaana 님과 #이어찍기 #추천 #fyp #viral #xyzbca #korean #おすすめ,12,fyp viral xyzbca korean,False,False,0,0,none,False,0,[],0,0.0,0.0252464395016431,0.0001671215723035,0.0004951320006512,0.0009344135760329,0.0001791307586245,neutral,0.9999876022338868
2400000,327,False,85,263100,2021-03-28T07:39:45.000Z,20100000,126000000,170400,"Answer to @annkemdubai11 , I finally made one for Spiderman. 21 hrs work. #thunderart #art #tomholland #viral #wow",17,"answer to , i finally made one for spiderman. 21 hrs work. thunderart art tomholland viral wow",False,False,0,0,none,False,0,[],0,0.0,0.0008577923290431,0.0001047011101036,0.0001347159122815,0.000179555703653,0.000120970820717,surprise,0.9766701459884644
5100000,37,False,136,233600,2021-01-09T15:38:27.000Z,20000000,227100000,1300000,Wee #foryou #foryoupage #tiktok #wee #funny #dog #animals #4u #xyzbca #fypage #fail #fyp #viral,7,wee foryou foryoupage tiktok wee funny dog animals 4u xyzbca fypage fail fyp viral,False,False,0,0,none,True,1,['animals'],1,0.25,0.5525820851325989,0.0007420983165502,0.0028802575543522,0.0343052335083484,0.0011346579995006,neutral,0.9962419271469116
5400000,1,False,322,308900,2021-05-12T12:55:38.000Z,20000000,354800000,379000,#viral #viral#foryou #foryou #foryoupage #kapsalonfreedomboxmeer,59,viral viral foryou foryou foryoupage kapsalonfreedomboxmeer,False,False,0,0,none,False,0,[],0,0.0,0.1064537540078163,0.0002826976706273,0.0004331615054979,0.0017599937273189,0.0004563587426673,neutral,0.9999866485595704
497400,583,False,2541,154800,2021-12-12T12:21:36.000Z,19500000,167400000,314100,#foryoupage #food #cooking #viral #sucuk #suçuk #keşfet,10,foryoupage food cooking viral sucuk su uk ke fet,False,False,0,0,none,False,0,[],0,0.0,0.0523198582231998,0.0003399209817871,0.0008455003844574,0.001653654850088,0.0005218180594965,neutral,0.9999589920043944
8000000,69,True,147,214600,2020-09-05T23:27:18.000Z,19400000,169500000,433300,Our WHOLE Zoom class pranked our teacher  (she was so confused!!) #foryou #foryoupage #fyp #tiktok #viral #funny #trend #trending #funny #lol,14,our whole zoom class pranked our teacher she was so confused!! foryou foryoupage fyp tiktok viral funny trend trending funny lol,True,False,2,0,we_only,False,0,[],0,0.0,0.0874780267477035,0.0001526923151686,0.0003286519204266,0.002961856778711,0.0002647053624968,amusement,0.897668719291687
3800000,371,True,238,100600,2019-11-19T09:31:40.000Z,18700000,165900000,368000,MAKE THIS MORE VIRAL THAN THE GIRL THAT UPLOADED ME AND DIDNT CREDIT @buiibeu  #foryou #foryoupage #fyp #dancemonkey #viral #inoxia #busker #singer,59,make this more viral than the girl that uploaded me and didnt credit foryou foryoupage fyp dancemonkey viral inoxia busker singer,False,False,0,0,none,False,0,[],0,0.0,0.1133115217089653,0.0001668254262767,0.000456149369711,0.0058115972205996,0.0002560474385973,disapproval,0.8916466236114502
2700000,100,False,304,256600,2021-05-30T20:31:04.000Z,18300000,204400000,543800,For my FOLLOWERS! # #candy #candydrawer #asmr #restock #refill #chocolate #krystleklear #fypシ #FYP #foryoupage #foryou #viral #kids #kidstiktok,54,for my followers! candy candydrawer asmr restock refill chocolate krystleklear fyp fyp foryoupage foryou viral kids kidstiktok,False,False,0,0,none,False,0,[],0,0.0,0.1110752448439598,0.0002037738740909,0.0006243980024009,0.003653101157397,0.0003937161527574,neutral,0.9996609687805176
2700000,96,True,1116,391100,2021-02-11T04:09:25.000Z,16900000,140900000,508600,@whatsondubai #eliefeghaly7 #dubai #uae #visitdubai #amazing #ksa #russia #moscow #fyp #foryoupage #viral #abovetheclouds #italy #india #uk #usa #uae,14,eliefeghaly7 dubai uae visitdubai amazing ksa russia moscow fyp foryoupage viral abovetheclouds italy india uk usa uae,False,False,0,0,none,False,0,[],0,0.0,0.001757939113304,9.596614836482333e-05,0.0001423543290002,0.0001918855996336,0.0001026439058477,admiration,0.9560317397117616
10500000,0,False,31,115100,2021-08-13T03:06:47.000Z,16800000,252100000,204400,❌ no te aproximes a mis otros videos #viral #trend #new #foryou #fyp #foryoupage #tiktokviral #fypage #parati #fypシ #4you #4u #parati,18,no te aproximes a mis otros videos viral trend new foryou fyp foryoupage tiktokviral fypage parati fyp 4you 4u parati,False,False,0,0,none,False,0,[],0,0.0,0.3769724667072296,0.0007497028564102,0.0019576270133256,0.0119554018601775,0.0010247534373775,neutral,0.8106615543365479
1100000,381,False,161,136900,2021-11-17T03:30:39.000Z,22800000,141200000,486100,Cactus Choir performing Industry Baby with my little demonic  babies #dancingcactus❤️❤️❤️ #cactus #industrybaby @lilnasx @Jack Harlow #music,34,cactus choir performing industry baby with my little demonic babies dancingcactus cactus industrybaby harlow music,False,False,0,0,none,False,0,[],0,0.0,0.0056479601189494,9.415406384505332e-05,0.0001834912691265,0.0003597817558329,0.0001460583880543,neutral,0.9999903440475464
5800000,2775,True,670,100900,2019-03-01T04:48:20.000Z,11600000,149500000,1200000,Teaching Granny Meme Songs  #foryou #comedy #dametucosita #fox #gmoney #music #meme #lol,13,teaching granny meme songs foryou comedy dametucosita fox gmoney music meme lol,False,False,0,0,none,False,0,[],0,0.0,0.0289939902722835,0.0001035866662277,0.0003156796738039,0.0015107839135453,0.0001937258202815,amusement,0.9996426105499268
6900000,0,False,393,573100,2021-04-16T20:08:22.000Z,11000000,74300000,52700,#foryoupage #react #music #fyp,34,foryoupage react music fyp,False,False,0,0,none,False,0,[],0,0.0,0.0538802035152912,0.0001541940582683,0.0002825456904247,0.0018299521179869,0.0001866778620751,neutral,0.999992609024048
16000000,1945,True,1176,63800,2020-03-04T20:36:49.000Z,10000000,68800000,104400,SINGING WITH @jamescharles  (How did we do?) #singing #fyp #tiktok #music #beatboxchallenge,19,singing with how did we do? singing fyp tiktok music beatboxchallenge,True,False,1,0,we_only,False,0,[],0,0.0,0.0077301124110817,9.483827307121828e-05,0.0001931039587361,0.0004088824498467,0.0001324102777289,neutral,0.5020282864570618
19500000,115,True,363,26100,2019-12-23T13:21:51.000Z,9600000,76300000,104400,Chillin in Doha  1 or 2 ? #qatarfoundation #jordikoalitic #photo #creative #4u #tiktok #funny #easy #tricks #music,11,chillin in doha 1 or 2 ? qatarfoundation jordikoalitic photo creative 4u tiktok funny easy tricks music,False,False,0,0,none,False,0,[],0,0.0,0.0011113261571153,9.79818869382143e-05,0.0001428550021955,0.0001900375063996,0.0001128441799664,amusement,0.9890824556350708
21200000,34,True,790,56200,2021-08-12T13:58:45.000Z,9500000,143000000,154100,Getting caught #mercuri_88 #littlebrother #mom #foryou #foryoupage #beggin #pov #trend #comedy #funny #humor #xyzbca #perte #music #fy #4u #fyp #fypシ,8,getting caught mercuri 88 littlebrother mom foryou foryoupage beggin pov trend comedy funny humor xyzbca perte music fy 4u fyp fyp,False,False,0,0,none,False,0,[],0,0.0,0.5262271761894226,0.0015082985628396,0.005546836182475,0.103364884853363,0.0007303770398721,amusement,0.9967939257621764
69100000,60,True,343,26300,2020-03-13T13:18:11.000Z,9300000,61300000,92600,Makeup Artist or Magician? @selenagomez #magic #music,14,makeup artist or magician? magic music,False,False,0,0,none,False,0,[],0,0.0,0.0007690151687711,0.0001107595817302,0.0001407658564858,0.0001877743197837,0.0001226048916578,neutral,0.8465461134910583
1400000,225,False,485,18000,2021-08-05T16:57:31.000Z,9100000,35800000,51100,You know I had to do it  @violin.tiktok #oboe #violin #music #musician #fyp ib:@twosetviolin,8,you know i had to do it .tiktok oboe violin music musician fyp ib,False,False,0,0,none,False,0,[],0,0.0,0.0008700556354597,0.00010628272139,0.0001431681012036,0.0001924543612403,0.0001079134381143,neutral,0.8281263709068298
534700,57,False,147,29500,2021-06-26T09:14:10.000Z,8600000,59000000,237400,Tory Lanez  #WorkThisWay #fyp #foryou #viral #trending #edit #celebrity #music #freestyle #torylanez,21,tory lanez workthisway fyp foryou viral trending edit celebrity music freestyle torylanez,False,False,0,0,none,False,0,[],0,0.0,0.0093421684578061,0.0001002188946586,0.0001645087468205,0.0004953609895892,0.0001358481094939,neutral,0.9999836683273317
16000000,1945,True,1176,62500,2020-03-11T00:19:27.000Z,8300000,55800000,59100,Aren’t we cute? ☺️ @addisonre (Tag your partner in crime) #fyp #singing #dance #tiktok #music #foryou,11,aren t we cute? tag your partner in crime fyp singing dance tiktok music foryou,True,False,1,0,we_only,False,0,[],0,0.0,0.0603344552218914,0.0001450279523851,0.0005309683619998,0.0020444928668439,0.0004682127037085,confusion,0.7843443751335144
12900000,71,True,552,12400,2020-02-20T11:52:28.000Z,8200000,57400000,16800,Hearts #fanart #foryou #music #billieeilish #song #fyp #art #billieeilishfans #зурхоккей #hcsalavat #singlelife #рольвтикток #СберЛюбимка,15,hearts fanart foryou music billieeilish song fyp art billieeilishfans hcsalavat singlelife,False,False,0,0,none,False,0,[],0,0.0,0.0045535713434219,9.43487320910208e-05,0.0001738457212923,0.0002921500126831,0.0001312342501478,neutral,0.9999336004257202
1600000,66,True,62,60900,2020-12-27T10:54:31.000Z,8100000,51800000,278800,Secret life of pets  #music #funny #foryou,30,secret life of pets music funny foryou,False,False,0,0,none,False,0,[],0,0.0,0.0009581708000041,0.0001038886839523,0.0001435034937458,0.000181105438969,0.0001194335563923,neutral,0.6961371898651123
1800000,35,False,507,22800,2021-05-29T22:19:28.000Z,7900000,40000000,17600,Her voice is angelic  #fyp #foryoupage #InTheHeightsChallenge #HoldMyMilk #music #foryou,21,her voice is angelic fyp foryoupage intheheightschallenge holdmymilk music foryou,False,False,0,0,none,False,0,[],0,0.0,0.1153531447052955,0.0002533575170673,0.0006769064348191,0.0045268717221915,0.000421388860559,neutral,0.9985790252685548
16000000,1945,True,1176,20500,2020-02-17T22:46:53.000Z,7800000,61200000,21900,HE DESTROYED MY PHONE  @topperguild #fyp #foryou #singing #tiktok #music,10,he destroyed my phone fyp foryou singing tiktok music,False,False,0,0,none,False,0,[],0,0.0,0.1603517234325409,0.0003232823510188,0.0005195157718844,0.0035166228190064,0.00054128235206,anger,0.6713465452194214
3400000,350,True,230,59400,2021-05-24T23:08:44.000Z,7500000,44400000,149800,Reply to @ur.emothot thank y’all so much for 800k it’s unbelievable I LOVE YALL SO MUCH #singing #cover #music,20,reply to .emothot thank y all so much for 800k it s unbelievable i love yall so much singing cover music,False,False,0,0,none,False,0,[],0,0.0,0.0009466995252296,0.0001078369023161,0.0001414840517099,0.0001777678407961,0.0001390667021041,gratitude,0.7988951206207275
273000,97,False,36,17000,2021-11-08T01:00:27.000Z,7200000,50100000,77600,Làm lại chiếc vid triệu view của Nữ Hoàng Ava Max  #avamax #music #lyrics #fyp #xuhuong,36,l m l i chi c vid tri u view c a n ho ng ava max avamax music lyrics fyp xuhuong,False,False,0,0,none,False,0,[],0,0.0,0.0477707274258136,0.0002991785004269,0.0007489034906029,0.0024262284860014,0.0003585887316148,neutral,0.9999862909317015
