authorMeta/fans,authorMeta/following,authorMeta/verified,authorMeta/video,commentCount,createTimeISO,diggCount,playCount,shareCount,text,videoMeta/duration,clean_text,has_we,has_them,we_count,them_count,pronoun_type,has_othering,othering_score,matched_patterns,othering_predicted,othering_proba,toxicity,severe_toxicity,identity_attack,insult,threat,emotion,emotion_score
147500000,75,True,1066,152500,2021-07-24T14:15:28.000Z,22100000,180700000,94900,I have to read and you disturb me.(Ps: Guys don’t try this at home Thx Khaby) #greenscreen #learnfromkhaby #learnwithtiktok #imparacontiktok #moon,15,i have to read and you disturb me. ps guys don t try this at home thx khaby greenscreen learnfromkhaby learnwithtiktok imparacontiktok moon,False,False,0,0,none,False,0,[],0,0.0,0.042477436363697,0.000126444545458,0.0003594932204578,0.0011902081314474,0.0003713128680828,annoyance,0.7405697703361511
147500000,75,True,1066,85800,2021-05-18T14:43:14.000Z,21500000,147500000,50200,Easy bro #LearnFromKhabi #LearnWithTikTok #ImparaConTikTok,24,easy bro learnfromkhabi learnwithtiktok imparacontiktok,False,False,0,0,none,False,0,[],0,0.0,0.0183036252856254,0.0001030409839586,0.0002674817806109,0.0006601557834073,0.0002302633511135,neutral,0.999941349029541
147500000,75,True,1066,108100,2021-06-20T14:36:25.000Z,20500000,171200000,169200,Good @cristiano! You ve learned  quickly my move!Bravo @cristiano!! Hai imparato velocemente la mia mossa#learnfromkhaby #learnwithtiktok,16,good ! you ve learned quickly my move!bravo !! hai imparato velocemente la mia mossa learnfromkhaby learnwithtiktok,False,False,0,0,none,False,0,[],0,0.0,0.0161384437233209,0.000111783047032,0.0002846269926521,0.0006549134268425,0.0003412449441384,admiration,0.9834088087081908
147500000,75,True,1066,110900,2021-04-21T14:01:06.000Z,20100000,185300000,204500,#LearnFromKhaby #ImparaConTikTok #LearnWithTikTok,25,learnfromkhaby imparacontiktok learnwithtiktok,False,False,0,0,none,False,0,[],0,0.0,0.0297704432159662,0.0001287247432628,0.0003332578053232,0.0009145165095105,0.0003687390126287,neutral,0.9997170567512512
147500000,75,True,1066,63200,2021-04-24T13:38:22.000Z,17800000,123600000,71500,with a final lick#LearnFromKhabi #ImparaConTikTok #LearnWithTikTok,20,with a final lick learnfromkhabi imparacontiktok learnwithtiktok,False,False,0,0,none,False,0,[],0,0.0,0.5350657105445862,0.0012211430585011,0.002552828984335,0.0383851379156112,0.0013507310068234,neutral,0.9999808073043824
147500000,75,True,1066,105900,2021-06-12T14:43:14.000Z,17200000,168700000,137100,Let’s eat  But I don't like seeing you make your life harder. Mangiamo  ma non mi piace che ti complichi la vita.#learnfromkhaby #LearnWithTikTok,23,let s eat but i don't like seeing you make your life harder. mangiamo ma non mi piace che ti complichi la vita. learnfromkhaby learnwithtiktok,False,False,0,0,none,False,0,[],0,0.0,0.121376983821392,0.0002378617355134,0.0010392387630417,0.0033365502022206,0.0014410628937184,disapproval,0.9855974316596984
147500000,75,True,1066,76600,2022-01-02T16:26:09.000Z,17100000,177900000,106800,I’m getting ready for Grammy Award .  Me estoy preparando para los Grammy #learnfromkhaby #learnwithtiktok @tiktok,15,i m getting ready for grammy award . me estoy preparando para los grammy learnfromkhaby learnwithtiktok,False,False,0,0,none,False,0,[],0,0.0,0.000999410287477,0.0001010511768981,0.0001337764551863,0.0001808714296203,0.000114855261927,excitement,0.9830746054649352
147500000,75,True,1066,76700,2021-05-02T14:42:21.000Z,16400000,156000000,104700,Non c’è bisogno di Didascalia——No Caption Needed. #learnfromkhaby #LearnWithTikTok #ImparaConTikTok #nocaptionneeded,26,non c bisogno di didascalia no caption needed. learnfromkhaby learnwithtiktok imparacontiktok nocaptionneeded,False,False,0,0,none,False,0,[],0,0.0,0.0206565968692302,0.0001090944933821,0.0003016429836861,0.0007657314417883,0.000250123324804,neutral,0.999991774559021
147500000,75,True,1066,110900,2021-06-01T14:12:34.000Z,16300000,174400000,83700,Mine is better than yours   Il mio è meglio del tuo #learnfromkhaby #ImparaConTikTok #LearnWithTikTok,26,mine is better than yours il mio meglio del tuo learnfromkhaby imparacontiktok learnwithtiktok,False,False,0,0,none,False,0,[],0,0.0,0.1584649682044983,0.0002464783028699,0.0010779347503557,0.0042279982008039,0.0010509478161111,neutral,0.9588770270347596
147500000,75,True,1066,99200,2021-08-03T14:17:30.000Z,15200000,143400000,39900,“Twrow back”- I’m in holidays! And I just wanna know Where are you guys? Love you all ❤️#learnfromkhaby#learnwithtiktok #imparacontiktok,14,twrow back - i m in holidays! and i just wanna know where are you guys? love you all learnfromkhaby learnwithtiktok imparacontiktok,False,False,0,0,none,False,0,[],0,0.0,0.0214122179895639,0.0001245064195245,0.0002885935246013,0.0007750578224658,0.0003630317514762,love,0.9920157194137572
147500000,75,True,1066,70500,2021-05-01T13:13:08.000Z,15100000,119600000,60400,Dalla terra alla luna \From land to moon#learnfromkhaby #LearnWithTikTok #ImparaConTikTok,10,dalla terra alla luna from land to moon learnfromkhaby learnwithtiktok imparacontiktok,False,False,0,0,none,False,0,[],0,0.0,0.0154227642342448,0.0001099626097129,0.0002606686321087,0.0005968823679722,0.0002620960876811,neutral,0.999984860420227
147500000,75,True,1066,100400,2021-06-26T14:31:50.000Z,14700000,95800000,101900,Nooo guys Please nooooo  #learnfromkhaby #learnwithtiktok #ImparaConTikTok,22,nooo guys please nooooo learnfromkhaby learnwithtiktok imparacontiktok,False,False,0,0,none,False,0,[],0,0.0,0.0443463213741779,0.000132887638756,0.0003997683816123,0.0011439060326665,0.0003633284650277,disapproval,0.9911289215087892
3800000,385,True,107,113800,2019-06-07T11:43:40.000Z,9800000,92400000,1300000,I got suspended for this #foryou #featurethis #uk creds: @_niamhmurphyy,15,i got suspended for this foryou featurethis uk creds,False,False,0,0,none,False,0,[],0,0.0,0.0076749888248741,0.0001095551706384,0.0001577300135977,0.0003989171527791,0.0001204140207846,neutral,0.6073399782180786
5000000,234,True,901,84700,2019-10-22T16:30:40.000Z,9500000,89400000,801500,Schick das deinem besten Freund ohne Vorwarnung  Instagram: @rickazas @backflipbaris #trending #featureme #featurethis #viral #fyp #comedy,10,schick das deinem besten freund ohne vorwarnung instagram trending featureme featurethis viral fyp comedy,False,False,0,0,none,False,0,[],0,0.0,0.2536231279373169,0.0005012705805711,0.0012834711233153,0.0063062286935746,0.0006674184696748,amusement,0.3668366372585296
22400000,26,True,309,10500,2020-10-17T13:41:07.000Z,7300000,69400000,30900,I THOUGHT I managed to cheat my dad but...  @daddyming #comedy #tiktok #fyp #foryou #viral #featurethis,49,i thought i managed to cheat my dad but... comedy tiktok fyp foryou viral featurethis,False,False,0,0,none,False,0,[],0,0.0,0.0780999809503555,0.0002203286712756,0.0003263545513618,0.0026354426518082,0.0002727923856582,amusement,0.8950285911560059
22400000,26,True,309,30900,2020-08-07T13:28:28.000Z,6600000,44100000,116900,Press “F” to pay respects (Dad edition)  Which one is the worst? @daddyming  #reacttothis #duetthis #fyp #foryou #featurethis,20,press f to pay respects dad edition which one is the worst? reacttothis duetthis fyp foryou featurethis,False,False,0,0,none,False,0,[],0,0.0,0.1013017892837524,0.0001676706451689,0.000427232531365,0.0037841107696294,0.0003328726452309,annoyance,0.8843202590942383
22400000,26,True,309,14200,2020-10-26T16:06:57.000Z,6100000,71000000,33700,I THOUGHT I could cheat my dad but...  #comedy #tiktok #fyp #foryou #viral #featurethis,58,i thought i could cheat my dad but... comedy tiktok fyp foryou viral featurethis,False,False,0,0,none,False,0,[],0,0.0,0.1542549282312393,0.0003560461627785,0.0005481748376041,0.0057508572936058,0.0003534254210535,realization,0.864967942237854
2600000,52,True,248,18000,2020-02-05T06:05:34.000Z,5500000,47900000,34400,What would happen if you tried this!  #foryourpage #gotolook #sowedecided #xyzbca #tiktok #makemefamous #tiktok #fyp #parkour #race #featurethis,18,what would happen if you tried this! foryourpage gotolook sowedecided xyzbca tiktok makemefamous tiktok fyp parkour race featurethis,False,False,0,0,none,False,0,[],0,0.0,0.190120130777359,0.0002769058628473,0.0014236605493351,0.0066075506620109,0.00078327790834,curiosity,0.9932119846343994
9900000,27,False,2636,7342,2019-08-24T13:10:47.000Z,5200000,56200000,158900,Rafta rafta  new h#tiktok#tiktok_india#featurethis#mukusquads#funny#comedy#comedyindia,13,rafta rafta new h tiktok tiktok india featurethis mukusquads funny comedy comedyindia,False,False,0,0,none,False,0,[],0,0.0,0.0098152235150337,9.926843631546944e-05,0.0002325009845662,0.0004849131219089,0.0001481158833485,amusement,0.9995588660240172
426200,526,False,246,20000,2020-01-07T06:48:18.000Z,5100000,24000000,108400,Painting challenge part 2! Wow #fy #fyp #foryou #foryoupage #viral #featurethis #painting #paint #artchallenge #art #backatwork #megamouth,58,painting challenge part 2! wow fy fyp foryou foryoupage viral featurethis painting paint artchallenge art backatwork megamouth,False,False,0,0,none,False,0,[],0,0.0,0.0460790917277336,0.0001556214992888,0.0002530120837036,0.0013405086938291,0.0002647182263899,surprise,0.904444694519043
22400000,26,True,309,7696,2020-10-22T17:15:02.000Z,4900000,35800000,16400,I THOUGHT I managed to cheat my dad but...  #comedy #tiktok #fyp #foryou #viral #featurethis,59,i thought i managed to cheat my dad but... comedy tiktok fyp foryou viral featurethis,False,False,0,0,none,False,0,[],0,0.0,0.0780999809503555,0.0002203286712756,0.0003263545513618,0.0026354426518082,0.0002727923856582,amusement,0.8950285911560059
417300,533,False,281,82800,2021-02-25T12:46:37.000Z,4800000,21900000,122700,We love you  #foryoupage #featurethis #tiktok #boopswithluca #snake #hognosesnake #hognose #hognosesnakes #snakesoftiktok,8,we love you foryoupage featurethis tiktok boopswithluca snake hognosesnake hognose hognosesnakes snakesoftiktok,True,False,1,0,we_only,False,0,[],0,0.0,0.0814671218395233,0.0002571527729742,0.0008956472738645,0.0021039333660155,0.0008474854403175,love,0.999728262424469
45900,153,False,26,86800,2021-02-28T15:32:03.000Z,4600000,23100000,288800,#pets #catsoftiktok #cat #featurethis #15svines #fyp #vine,12,pets catsoftiktok cat featurethis 15svines fyp vine,False,False,0,0,none,False,0,[],0,0.0,0.0171207003295421,0.0001049699276336,0.0002557475818321,0.0006753345369361,0.0001812042319215,neutral,0.999991536140442
8300000,176,True,415,35000,2019-07-01T10:48:50.000Z,4200000,41500000,81700,Same same but different  #viral #featurethis #tiktok #foryoupage #parkour #australia #spiderman,20,same same but different viral featurethis tiktok foryoupage parkour australia spiderman,False,False,0,0,none,False,0,[],0,0.0,0.001841472228989,8.930810872698203e-05,0.0001447211398044,0.0002195337001467,0.0001079503854271,neutral,0.9997498393058776
3400000,7428,True,783,18900,2022-01-14T21:00:08.000Z,4200000,37900000,71600,Most difficult TikTok I have done. Two bat flips and two hat flips. The timing and first hat was most difficult #foryou #foryoupage #featurethis,15,most difficult tiktok i have done. two bat flips and two hat flips. the timing and first hat was most difficult foryou foryoupage featurethis,False,False,0,0,none,False,0,[],0,0.0,0.0043751667253673,9.081816097022966e-05,0.0001534000912215,0.0003228268178645,0.0001142612163675,neutral,0.9999914169311525
8700000,4,True,89,10200,2020-09-07T14:41:17.000Z,4200000,32000000,43700,Don’t mess with Daddy Ming  Which prank is the best? @mingweirocks  #prank #duetthis #reacttothis #fyp #foryou #featurethis,20,don t mess with daddy ming which prank is the best? prank duetthis reacttothis fyp foryou featurethis,False,False,0,0,none,False,0,[],0,0.0,0.2492253184318542,0.0002839410153683,0.0004968557623215,0.0081161251291632,0.0005409107543528,annoyance,0.8857297897338867
22400000,26,True,309,5875,2020-10-13T13:36:19.000Z,4100000,36400000,9707,I THOUGHT I managed to cheat my dad but...  @daddyming #comedy #tiktok #fyp #foryou #viral #featurethis,34,i thought i managed to cheat my dad but... comedy tiktok fyp foryou viral featurethis,False,False,0,0,none,False,0,[],0,0.0,0.0780999809503555,0.0002203286712756,0.0003263545513618,0.0026354426518082,0.0002727923856582,amusement,0.8950285911560059
5600000,184,False,293,7309,2019-11-28T03:06:45.000Z,4100000,37600000,615200,OMG IT WORKED!! #duet with @quikplay  #fyp #foryou #hack #vendingmachine #foryoupage #featuerme #feature #featurethis #quikplay,34,omg it worked!! duet with fyp foryou hack vendingmachine foryoupage featuerme feature featurethis quikplay,False,False,0,0,none,False,0,[],0,0.0,0.0212601348757743,0.0001062203082256,0.0002016268554143,0.0009211066062562,0.000199110028916,surprise,0.5528689026832581
2800000,1,False,1957,10700,2019-11-17T10:22:32.000Z,4000000,56400000,103200,More luxury life for humans #viral #trending #foryoupage #tiktok #foryou #featurethis #featureme #1millionaudition #1m @tiktok @tiktokglobal @tiktok_i,10,more luxury life for humans viral trending foryoupage tiktok foryou featurethis featureme 1millionaudition 1m,False,False,0,0,none,False,0,[],0,0.0,0.0015132272383198,9.316591604147106e-05,0.0001447929244022,0.0002100694837281,0.0001193946154671,neutral,0.999980926513672
1400000,1346,True,651,16600,2019-01-09T19:34:39.000Z,4000000,51600000,47000,Wait for the #mwah  #hitormiss #uksports #featurethis #foryoupage #uktalent #mermaidgrace #ukvlog,15,wait for the mwah hitormiss uksports featurethis foryoupage uktalent mermaidgrace ukvlog,False,False,0,0,none,False,0,[],0,0.0,0.0099046314135193,9.309656161349268e-05,0.0002049561007879,0.0004680067650042,0.0001528258871985,neutral,0.9999905824661256
625000,601,False,514,13500,2019-02-02T22:30:43.000Z,3800000,48500000,114000,My dad isn’t proud of me #featureme #featurethis #viral #like #foryoupage #foryou,9,my dad isn t proud of me featureme featurethis viral like foryoupage foryou,False,False,0,0,none,False,0,[],0,0.0,0.0426807478070259,0.000134050991619,0.0002317781181773,0.001234674360603,0.0002412277244729,disapproval,0.5467536449432373
5700000,9,True,34500,11000,2019-01-15T00:26:33.000Z,3500000,76200000,80700,#featurethis #uksports #featureme #2019goals #feature #gocreate,14,featurethis uksports featureme 2019goals feature gocreate,False,False,0,0,none,False,0,[],0,0.0,0.0041607581079006,8.836878987494856e-05,0.0001589578168932,0.0002934066869784,9.719016816234216e-05,neutral,0.9999902248382568
55000000,8858,True,1310,94400,2020-02-16T03:40:01.000Z,17600000,226300000,167100,Shaving prank gone wrong  #trend #comedy #prank #fail,16,shaving prank gone wrong trend comedy prank fail,False,False,0,0,none,False,0,[],0,0.0,0.1291522681713104,0.0002105756284436,0.0003551188565324,0.0039892173372209,0.0003056130663026,disapproval,0.6872704029083252
7300000,99,True,425,86100,2022-04-02T17:23:13.000Z,15500000,243800000,281300,That HURT‼️ #virall #funny #prank #fyp #foryourpage #tiktok,11,that hurt virall funny prank fyp foryourpage tiktok,False,False,0,0,none,False,0,[],0,0.0,0.6764628887176514,0.0014179331483319,0.0025926211383193,0.0419412888586521,0.0012783317361027,amusement,0.979972779750824
664200,276,False,314,53500,2021-11-01T04:20:41.000Z,14800000,66100000,323500,Just take one #fyp #halloween #prank #scare #scareprank #mikemyers #michaelmyers #trickortreats #viral,44,just take one fyp halloween prank scare scareprank mikemyers michaelmyers trickortreats viral,False,False,0,0,none,False,0,[],0,0.0,0.2626233100891113,0.0003565500956028,0.0008240399183705,0.0079657128080725,0.000810845347587,neutral,0.9999468326568604
282000,38,False,5,213600,2020-12-24T20:32:27.000Z,14600000,66800000,355200,#fyp #scare #prank,7,fyp scare prank,False,False,0,0,none,False,0,[],0,0.0,0.0802277848124504,0.0001617251982679,0.0004390043322928,0.0028777609113603,0.0002278157771797,neutral,0.9836077094078064
18600000,1644,True,1164,21100,2020-01-19T23:09:08.000Z,14500000,126700000,80300,Got my parents so good with this shaving prank  #trend #comedy #prank,10,got my parents so good with this shaving prank trend comedy prank,False,False,0,0,none,False,0,[],0,0.0,0.0352730527520179,0.0001498161145718,0.0002272876881761,0.0013038079487159,0.0001803300256142,approval,0.650854229927063
34800000,100,True,2687,74900,2020-09-10T18:34:29.000Z,14500000,159000000,155800,"А вы бы отдали обратно? Если да, то подпишись и лайкни | Would you give it back? #thekiryalife #prank #reaction #социальныйролик #реакции #пранк",57,"? , would you give it back? thekiryalife prank reaction",False,False,0,0,none,False,0,[],0,0.0,0.0017818476771935,8.961436833487824e-05,0.0001524367253296,0.0002230951358797,0.0001091407975764,curiosity,0.9890851378440856
2500000,198,False,641,36100,2020-02-29T17:46:08.000Z,14200000,131500000,162000,short dog problems  #prank #corgi #dog #fyp #foryourpage,10,short dog problems prank corgi dog fyp foryourpage,False,False,0,0,none,False,0,[],0,0.0,0.4832071661949157,0.0005455526988953,0.0026928433217108,0.0881813466548919,0.0004127488937228,neutral,0.997757852077484
2000000,33,False,55,36000,2022-04-30T13:53:00.000Z,13500000,173200000,29700,Part-24  #lamborghini #girl #prank #foryou #fypシ #fyp,26,part-24 lamborghini girl prank foryou fyp fyp,False,False,0,0,none,False,0,[],0,0.0,0.4027494788169861,0.0012215827591717,0.006215342786163,0.0763786658644676,0.0007038912735879,neutral,0.999666690826416
55000000,8858,True,1310,15600,2020-01-28T06:15:15.000Z,12700000,146800000,72100,Pranked my barber today  #trend #comedy #prank,11,pranked my barber today trend comedy prank,False,False,0,0,none,False,0,[],0,0.0,0.0160092003643512,9.826484165387228e-05,0.0002012717013712,0.0007187763112597,0.0001480722421547,amusement,0.9997239708900452
34800000,100,True,2687,94600,2020-10-05T01:39:19.000Z,12100000,136700000,108500,"Kidnapping experiment...Would u help?- If yes, then Like it and Follow me(IG:@thekiryalife) #thekiryalife #пранк #prank #reaction #реакции",26,"kidnapping experiment...would u help?- if yes, then like it and follow me ig thekiryalife prank reaction",False,False,0,0,none,False,0,[],0,0.0,0.001093266881071,9.943355689756572e-05,0.0001396537845721,0.0001893140870379,0.0001097767599276,curiosity,0.9459638595581056
5800000,3,False,395,67300,2021-05-02T16:27:46.000Z,11800000,51700000,150000,Can you guess what happened next @montyydm_t.v @devthatman @k.lala104 AMOSC:Montyy_tuk Devon0607 #fyp #mom #prank #funny #lol,19,can you guess what happened next .v .lala104 amosc montyy tuk devon0607 fyp mom prank funny lol,False,False,0,0,none,False,0,[],0,0.0,0.0450691767036914,0.0001366322685498,0.0003707785508595,0.0022353373933583,0.000182007701369,amusement,0.9984362721443176
1400000,16,False,142,44200,2021-03-06T08:03:36.000Z,11800000,138400000,297700,HE FREAKED WHEN HE SAW IT #PRANK,59,he freaked when he saw it prank,False,False,0,0,none,False,0,[],0,0.0,0.0084336437284946,0.000103430917079,0.0001861659256974,0.0004443297511897,0.000117140742077,neutral,0.4982866048812866
55000000,8858,True,1310,20500,2020-01-02T06:56:33.000Z,11400000,105800000,67500,Head hitting beatbox prank  Got them good  @jonklaasen @elyssajoy_ #beatbox #comedy #prank,9,head hitting beatbox prank got them good beatbox comedy prank,False,True,0,1,them_only,False,0,[],0,0.0,0.0216732062399387,0.0001107127900468,0.0002148076309822,0.0009885200997814,0.000161678326549,neutral,0.9221164584159852
1800000,76,False,676,108600,2021-10-09T16:17:09.000Z,11400000,74200000,537400,Reply to @athamondia  thanks for the idea!  #parentslove #parents #dad #foryoupage #foryou #fyp #prank,17,reply to thanks for the idea! parentslove parents dad foryoupage foryou fyp prank,False,False,0,0,none,False,0,[],0,0.0,0.0454665832221508,0.00011470814934,0.0003126462106592,0.0017575207166373,0.0002198650909122,gratitude,0.9999204874038696
11800000,38,False,716,52900,2021-03-23T17:17:55.000Z,11100000,187700000,76300,"Как думаешь, что было дальше? Inst:fitnesstonya телегрмм в шапке профиля#prank #foryou #fyp #reaction",21,", ? inst fitnesstonya prank foryou fyp reaction",False,False,0,0,none,False,0,[],0,0.0,0.2451911717653274,0.0003888145147357,0.0007894912851043,0.0129538169130682,0.0003448466304689,curiosity,0.326871246099472
2300000,47,False,273,82400,2021-04-06T23:21:24.000Z,10900000,58100000,128800,#fyp #prank,37,fyp prank,False,False,0,0,none,False,0,[],0,0.0,0.1727971732616424,0.0002852591860573,0.0006863371818326,0.0084424009546637,0.0002410444867564,annoyance,0.5818058848381042
29100000,467,True,1819,23200,2020-01-07T01:38:21.000Z,10600000,100800000,56000,"Ruining people’s iPhones, then giving them the iPhone 11 Pro Max  #prank",28,"ruining people s iphones, then giving them the iphone 11 pro max prank",False,True,0,1,them_only,False,0,[],0,0.0,0.051835972815752,0.0001312488893745,0.0003066152858082,0.0017986361635848,0.0003508562804199,neutral,0.7876008749008179
1700000,99,True,259,37500,2021-05-26T16:29:19.000Z,10600000,118800000,78100,I was almost free‍♂️ #viral #foryoupage #fypシ #foryou #police #voorjou #funnyy #prank #fyppage,17,i was almost free viral foryoupage fyp foryou police voorjou funnyy prank fyppage,False,False,0,0,none,False,0,[],0,0.0,0.0805045068264007,0.000191820130567,0.0003240318328607,0.0023013700265437,0.0003814813389908,amusement,0.8071350455284119
11800000,38,False,716,33400,2021-03-23T19:42:29.000Z,10400000,130200000,47200,Она оказалась... inst:fitnesstonya#prank #foryou #fyp #reaction,21,... inst fitnesstonya prank foryou fyp reaction,False,False,0,0,none,False,0,[],0,0.0,0.270331859588623,0.0004109417786821,0.000817623862531,0.0130343521013855,0.0004048431292176,neutral,0.7444877624511719
34800000,100,True,2687,42800,2020-09-18T17:13:02.000Z,10100000,57400000,18500,"Would you help?- If yes, then Like it and Follow me Вы бы помогли?- Если да, то Лайкни и Подпишись #thekiryalife #пранк #prank #reaction #реакции",44,"would you help?- if yes, then like it and follow me ?- , thekiryalife prank reaction",False,False,0,0,none,False,0,[],0,0.0,0.0007592895417474,0.0001132971301558,0.0001424347137799,0.0001815451105358,0.0001286631450057,curiosity,0.9940457344055176
8000000,69,True,147,214600,2020-09-05T23:27:18.000Z,19400000,169500000,433300,Our WHOLE Zoom class pranked our teacher  (she was so confused!!) #foryou #foryoupage #fyp #tiktok #viral #funny #trend #trending #funny #lol,14,our whole zoom class pranked our teacher she was so confused!! foryou foryoupage fyp tiktok viral funny trend trending funny lol,True,False,2,0,we_only,False,0,[],0,0.0,0.0874780267477035,0.0001526923151686,0.0003286519204266,0.002961856778711,0.0002647053624968,amusement,0.897668719291687
397900,26,False,5,50000,2022-02-25T10:51:01.000Z,17000000,140800000,68500,Just vibing with my guy #fyp #trending #foryoupage #sayitright,8,just vibing with my guy fyp trending foryoupage sayitright,False,False,0,0,none,False,0,[],0,0.0,0.0158362835645675,0.000109434047772,0.0001743517059367,0.0006561198388226,0.0001494566968176,neutral,0.9999885559082032
11600000,41,True,1138,116700,2021-01-29T03:10:37.000Z,15800000,185200000,225300,@marblemannequin x DAVIDBECK #bellletstalk #xgamesmode #xyzbca #asmr #satisfying #trending #viral #fyp #foryou #foryoupage #4u #duet #fypシ #fypg #fu,11,x davidbeck bellletstalk xgamesmode xyzbca asmr satisfying trending viral fyp foryou foryoupage 4u duet fyp fypg fu,False,False,0,0,none,False,0,[],0,0.0,0.6511625647544861,0.0029607403557747,0.0044990996830165,0.065595731139183,0.0014013894833624,neutral,0.9999698400497437
3500000,1533,False,295,201600,2021-01-19T00:02:57.000Z,14800000,100500000,404400,We couldn’t of done it without our huge family #arlostrong #fypシ #4yp #trending #viral #k9softiktok #tiktokdogs,53,we couldn t of done it without our huge family arlostrong fyp 4yp trending viral k9softiktok tiktokdogs,True,False,2,0,we_only,False,0,[],0,0.0,0.2378430366516113,0.0006320122047327,0.0054739890620112,0.0156887471675872,0.0007024036021903,realization,0.3006691634654999
7700000,182,False,1419,66500,2021-07-04T19:00:27.000Z,13600000,85000000,291600,Why was she happy tho  #fyp #viral #gnb #share #trend #trending #verifyme #couple #foryou @britneyy.official,59,why was she happy tho fyp viral gnb share trend trending verifyme couple foryou .official,False,False,0,0,none,False,0,[],0,0.0,0.0044167297892272,9.928301005857064e-05,0.0001489946735091,0.0003123893984593,0.0001026212994474,curiosity,0.9678049087524414
957100,13,False,51,256900,2022-02-03T21:20:06.000Z,13300000,172700000,541100,We tried lol  #fyp #viral #baby #mommydaughter #fypシ #trending #foryou #foryoupage,10,we tried lol fyp viral baby mommydaughter fyp trending foryou foryoupage,True,False,1,0,we_only,False,0,[],0,0.0,0.3400756418704986,0.0005124322487972,0.0009869942441582,0.0252279322594404,0.0003866940387524,amusement,0.9998266100883484
323700,30,False,39,256000,2022-01-17T19:46:07.000Z,12900000,43800000,759300,Her go fund me is in my bio❤️❤️ #fyp #viral #trending #hospital,9,her go fund me is in my bio fyp viral trending hospital,False,False,0,0,none,False,0,[],0,0.0,0.1914081871509552,0.000476188986795,0.0005264718201942,0.0102090062573552,0.0003659720241557,neutral,0.999991536140442
8100000,36,False,146,135100,2021-04-22T19:05:37.000Z,12500000,58200000,591600,Happy earth day   #foryou #foryoupage #trending #fypシ #xyzbca #earthday #foryourpage #fup,59,happy earth day foryou foryoupage trending fyp xyzbca earthday foryourpage fup,False,False,0,0,none,False,0,[],0,0.0,0.7103106379508972,0.0077402316965162,0.0059270085766911,0.1822501868009567,0.0021477390546351,joy,0.8385054469108582
